{
  "$schema": "./doorstar-faipari-terminology.schema.json",
  "schemaFile": "doorstar-faipari-terminology.schema.json",
  "schemaVersion": "doorstar-terminology/v1",
  "version": "1.0.0",
  "publishedAt": "2026-07-31",
  "language": "hu-HU",
  "scope": "Import- és UI-normalizálás szempontjából kritikus részhalmaz; a teljes emberi fogalomtár az authoritativeMarkdown dokumentumban van.",
  "authoritativeMarkdown": "DOORSTAR_FAIPARI_TERMINOLOGIAI_SZOTAR_2026-07-31.md",
  "evidencePolicy": "A szótár keresési és normalizálási szabály; nem helyettesíti a rekord forrásútját, lokátorát, nyers értékét vagy emberi review-ját.",
  "lookupPolicy": {
    "version": "doorstar-terminology-lookup/v1",
    "sourceTermMatching": "Unicode-normalizált keresés, de automatikus megfeleltetéshez kötelező a category és authority context; kontextus nélkül csak találati lista adható.",
    "codeTermMatching": "Kis- és nagybetűérzékeny, pontos egyezés.",
    "collisionPolicy": "Ha több rekord marad, nincs automatikus cél; az effektív policy sorrendje FORBIDDEN > REVIEW_REQUIRED > ALIAS_ONLY > ALLOW.",
    "targetPolicy": "A legacyCodeTerms csak olvasási kompatibilitás; új írás kizárólag meglévő codeTerms vagy jóváhagyott targetCodeTerms alapján készülhet."
  },
  "dimensionOrder": ["WIDTH", "HEIGHT", "THICKNESS_OR_DEPTH"],
  "unit": "mm",
  "classifications": ["CANONICAL", "DOORSTAR_LOCAL", "SYSTEM_TERM", "REVIEW", "DEPRECATED"],
  "automationPolicies": ["ALLOW", "ALIAS_ONLY", "REVIEW_REQUIRED", "FORBIDDEN"],
  "terms": [
    {
      "id": "project",
      "category": "BUSINESS",
      "canonicalHu": "Projekt",
      "english": "Project",
      "sourceTerms": ["Projekt", "Project"],
      "codeTerms": ["Project"],
      "classification": "SYSTEM_TERM",
      "automationPolicy": "ALLOW",
      "definition": "Egy új ügyféligényhez vagy megrendeléshez létrehozott önálló munkascope; ismételt ügyfél esetén is új.",
      "mustNotMean": ["ügyfél", "korábbi újrahasznosított megrendelés"]
    },
    {
      "id": "production-order-envelope",
      "category": "SYSTEM",
      "canonicalHu": "Rendelés / revíziókonténer",
      "english": "Order revision envelope",
      "sourceTerms": ["Rendelés", "ProductionOrder"],
      "codeTerms": ["ProductionOrder"],
      "classification": "SYSTEM_TERM",
      "automationPolicy": "REVIEW_REQUIRED",
      "definition": "A projekthez kapcsolt rendszeraggregate, amely a rendelésrevíziókat birtokolja; Sales-piszkozatnál már létezhet.",
      "mustNotMean": ["gyártásra kiadás", "Sales PDF", "tényleges műhelyi munkamegrendelés"]
    },
    {
      "id": "sales-manufacturing-order",
      "category": "DOCUMENT",
      "canonicalHu": "Sales gyártásmegrendelés",
      "english": "Sales-to-workshop handoff",
      "sourceTerms": ["GYÁRTÁSMEGRENDELÉS", "Gyártásmegrendelés", "Sales order"],
      "codeTerms": ["SALES_ORDER"],
      "classification": "DOORSTAR_LOCAL",
      "automationPolicy": "ALIAS_ONLY",
      "definition": "A Sales műhelynek átadott elsődleges dokumentuma és kiinduló bizonyítéka.",
      "mustNotMean": ["jóváhagyott gyártási kiadás", "végleges felmérési adat"]
    },
    {
      "id": "site-survey",
      "category": "BUSINESS",
      "canonicalHu": "Helyszíni felmérés",
      "english": "Site survey",
      "sourceTerms": ["Felmérés", "Survey"],
      "codeTerms": ["SURVEY_PENDING", "SURVEY_COMPLETED"],
      "classification": "CANONICAL",
      "automationPolicy": "ALLOW",
      "definition": "A beépítési környezet és a gyártást befolyásoló műszaki adatok ellenőrzése és véglegesítése.",
      "mustNotMean": ["Sales dokumentumátvétel"]
    },
    {
      "id": "product-documentation",
      "category": "DOCUMENT",
      "canonicalHu": "Gyártmánydokumentáció",
      "english": "Product documentation",
      "sourceTerms": ["Gyártmánydokumentáció"],
      "codeTerms": [],
      "classification": "CANONICAL",
      "automationPolicy": "ALLOW",
      "definition": "A termék meghatározását, rajzát, szerkezetét, méreteit és műszaki leírását tartalmazó dokumentáció.",
      "mustNotMean": ["gyártásdokumentáció"]
    },
    {
      "id": "manufacturing-documentation",
      "category": "DOCUMENT",
      "canonicalHu": "Gyártásdokumentáció",
      "english": "Manufacturing documentation",
      "sourceTerms": ["Gyártásdokumentáció"],
      "codeTerms": [],
      "classification": "CANONICAL",
      "automationPolicy": "ALLOW",
      "definition": "Az előállításhoz szükséges anyag-, alkatrész-, technológiai, szabás- és műveleti adatok dokumentációja.",
      "mustNotMean": ["egyetlen Sales PDF"]
    },
    {
      "id": "parts-list",
      "category": "DOCUMENT",
      "canonicalHu": "Alkatrészjegyzék",
      "english": "Parts list",
      "sourceTerms": ["Alkatrészlista", "Alkatrészjegyzék"],
      "codeTerms": ["ComponentRequirement"],
      "classification": "CANONICAL",
      "automationPolicy": "ALLOW",
      "definition": "A gyártandó alkatrészek azonosított, mennyiségi és méretadatait tartalmazó jegyzék.",
      "mustNotMean": ["szabásjegyzék"]
    },
    {
      "id": "cutting-list",
      "category": "DOCUMENT",
      "canonicalHu": "Szabásjegyzék",
      "english": "Cutting list",
      "sourceTerms": ["Szabászati lista", "Szabásjegyzék"],
      "codeTerms": [],
      "classification": "CANONICAL",
      "automationPolicy": "ALLOW",
      "definition": "A szabászathoz kiadott szabászati méreteket, alapanyagot és mennyiséget tartalmazó jegyzék.",
      "mustNotMean": ["alkatrész készméretét tartalmazó általános lista"]
    },
    {
      "id": "operation-plan",
      "category": "PROCESS",
      "canonicalHu": "Műveleti terv",
      "english": "Operation plan / routing",
      "sourceTerms": ["Műveletsor", "Folyamat", "Részletes műveletterv"],
      "codeTerms": ["PlannedOperation"],
      "classification": "CANONICAL",
      "automationPolicy": "ALIAS_ONLY",
      "definition": "A végrehajtandó műveletek sorrendje, erőforrása, normája és függősége.",
      "mustNotMean": ["hat makroállapot"]
    },
    {
      "id": "work-session",
      "category": "SYSTEM",
      "canonicalHu": "Munkamenet",
      "english": "Work session",
      "sourceTerms": ["Munkamenet"],
      "codeTerms": ["ProjectWorkSession"],
      "classification": "REVIEW",
      "automationPolicy": "REVIEW_REQUIRED",
      "definition": "Felhasználói vagy végrehajtási munkaszakasz; a teljes gyártási folyamatra a gyártási folyamat kifejezés használandó.",
      "mustNotMean": ["egyszerre 17 művelet és 6 makroszakasz"]
    },
    {
      "id": "door-set",
      "category": "PRODUCT",
      "canonicalHu": "Ajtóegység",
      "english": "Doorset",
      "sourceTerms": ["Ajtóegység", "Teljes ajtószerkezet"],
      "codeTerms": [],
      "classification": "CANONICAL",
      "automationPolicy": "ALLOW",
      "definition": "Az együtt kezelt ajtólap, tokszerkezet és szükséges vasalatok, illetve tömítések.",
      "mustNotMean": ["csak ajtólap"]
    },
    {
      "id": "door-leaf",
      "category": "PRODUCT",
      "canonicalHu": "Ajtólap",
      "english": "Door leaf",
      "sourceTerms": ["Ajtólap", "Ajtószárny"],
      "codeTerms": ["doorWidthMm", "doorHeightMm", "doorThicknessMm"],
      "classification": "CANONICAL",
      "automationPolicy": "ALLOW",
      "definition": "Az ajtónyílást lezáró mozgó elem.",
      "mustNotMean": ["ajtótok", "falnyílás"]
    },
    {
      "id": "door-frame",
      "category": "PRODUCT",
      "canonicalHu": "Ajtótok / tokszerkezet",
      "english": "Door frame",
      "sourceTerms": ["Tok", "Ajtótok", "Tokszerkezet"],
      "codeTerms": [],
      "classification": "CANONICAL",
      "automationPolicy": "ALLOW",
      "definition": "A falnyíláshoz rögzített, az ajtólapot fogadó teljes keretrendszer.",
      "mustNotMean": ["tokmag", "tokborítás"]
    },
    {
      "id": "frame-lining",
      "category": "PRODUCT",
      "canonicalHu": "Tokmag / tokbélés",
      "english": "Frame lining / lining board",
      "sourceTerms": ["Tokmag", "Tokbélés", "Tokfal"],
      "codeTerms": [],
      "classification": "REVIEW",
      "automationPolicy": "REVIEW_REQUIRED",
      "definition": "Az átfogó tok központi, a falkávát burkoló része; a Doorstar BOM pontos határa profilfüggő.",
      "mustNotMean": ["teljes ajtótok"]
    },
    {
      "id": "frame-casing",
      "category": "PRODUCT",
      "canonicalHu": "Tokborítás",
      "english": "Casing / architrave",
      "sourceTerms": ["Tokborítás", "Borítás", "Borítóléc"],
      "deprecatedSourceTerms": ["Borítás"],
      "codeTerms": ["PositionCasingSpecification"],
      "classification": "CANONICAL",
      "automationPolicy": "ALIAS_ONLY",
      "definition": "A fal síkján látható, a tok–fal csatlakozást takaró szerkezeti elem.",
      "mustNotMean": ["felületkezelés", "dekorfólia", "falpanel"]
    },
    {
      "id": "fixed-casing-role",
      "category": "PRODUCT",
      "canonicalHu": "Fix tokborítás",
      "english": "Fixed casing role",
      "sourceTerms": ["Fix borítás"],
      "codeTerms": ["FIXED"],
      "classification": "CANONICAL",
      "automationPolicy": "REVIEW_REQUIRED",
      "definition": "A tokszerkezethez rögzített, nem falvastagság-állító tokborítási szerep.",
      "mustNotMean": ["fix tok", "SIDE_A", "pántoszlop"]
    },
    {
      "id": "adjustable-casing-role",
      "category": "PRODUCT",
      "canonicalHu": "Állítható tokborítás",
      "english": "Adjustable casing role",
      "sourceTerms": ["Állítható borítás", "Mozgó borítás", "Mobil borítás"],
      "deprecatedSourceTerms": ["Mozgó borítás", "Mobil borítás"],
      "codeTerms": ["ADJUSTABLE"],
      "classification": "CANONICAL",
      "automationPolicy": "ALIAS_ONLY",
      "definition": "A kész falvastagsághoz állítható, jellemzően horonyba illesztett tokborítás.",
      "mustNotMean": ["használat közben mozgó elem", "SIDE_B", "záróoszlop"]
    },
    {
      "id": "hinge-jamb",
      "category": "PRODUCT",
      "canonicalHu": "Pántoszlop",